{
  "$schema": "https://brain.arunp.in/schemas/youtube-preseal-readiness-v1.json",
  "schema_version": "1.0",
  "authority": "commit_a_preseal_readiness_and_governance_boundary",
  "status": "ready_for_commit_a",
  "validated_at": "2026-07-19T02:27:48+05:30",
  "validation": {
    "benchmark_tool_tests_passed": 289,
    "benchmark_tool_tests_total": 289,
    "a1_harness_tests_passed": 20,
    "a1_harness_tests_total": 20,
    "model_harness_tests_passed": 29,
    "model_harness_tests_total": 29,
    "targeted_tests_passed": 338,
    "targeted_tests_total": 338,
    "typecheck_passed": true,
    "targeted_lint_passed": true,
    "strict_schema_validation_passed": true,
    "markdown_links_passed": true,
    "privacy_scan_passed": true,
    "git_diff_check_passed": true
  },
  "independent_review": {
    "artifact_path": "docs/feature-council/youtube-transcript-enrichment/reviews/YOUTUBE_TRANSCRIPT_ENRICHMENT_PROSPECTIVE_BENCHMARK_PRE_LOCK_PACKAGE_ADVERSARIAL_REVIEW_2026-07-18_12-57-42_IST.md",
    "same_reviewer_required": true,
    "required_closure_marker": "prelock_review_closure_complete"
  },
  "prohibitions": {
    "primary_outputs_present": false,
    "lock_present_at_commit_a": false,
    "request_counter_scope": "gate_1_through_gate_5_primary_execution_only_excludes_public_source_research_artifact_acquisition_and_repository_delivery_metadata",
    "primary_benchmark_external_requests": 0,
    "primary_benchmark_provider_calls": 0,
    "model_inference_calls": 0,
    "incremental_spend_usd": 0
  },
  "authority_boundary": {
    "immutable_claim_authorities": [
      "docs/feature-council/youtube-transcript-enrichment/benchmark/BENCHMARK_PROTOCOL.md",
      "docs/feature-council/youtube-transcript-enrichment/benchmark/RUN_PLAN.md",
      "docs/feature-council/youtube-transcript-enrichment/benchmark/METHOD_ITEM_MATRIX.json",
      "docs/feature-council/youtube-transcript-enrichment/benchmark/REFERENCE_LEDGER.json",
      "docs/feature-council/youtube-transcript-enrichment/benchmark/model/LOCAL_DERIVATION_AUTHORIZATION.json",
      "docs/feature-council/youtube-transcript-enrichment/benchmark/model/LOCAL_MODEL_RUNTIME_LEDGER.json",
      "docs/feature-council/youtube-transcript-enrichment/benchmark/model/EVALUATOR_EXECUTION_CONTRACT.json",
      "docs/feature-council/youtube-transcript-enrichment/benchmark/model/A1_EXECUTION_CONTRACT.json",
      "docs/feature-council/youtube-transcript-enrichment/benchmark/model/A1_EXECUTION_CONTRACT.schema.json",
      "docs/feature-council/youtube-transcript-enrichment/benchmark/model/A1_OPERATOR_RECEIPT.schema.json",
      "docs/feature-council/youtube-transcript-enrichment/benchmark/model/A1_ATTEMPT_CLAIM.schema.json",
      "docs/feature-council/youtube-transcript-enrichment/benchmark/model/A1_ATTEMPT_TERMINAL.schema.json",
      "docs/feature-council/youtube-transcript-enrichment/benchmark/PRESEAL_READINESS.json",
      "docs/feature-council/youtube-transcript-enrichment/benchmark/LOCK.json"
    ],
    "post_seal_mutable_status_documents": [
      "RUNNING_LOG.md",
      "docs/feature-council/youtube-transcript-enrichment/MASTER_EXECUTION_INDEX.md",
      "docs/feature-council/youtube-transcript-enrichment/TRACKER.md",
      "docs/feature-council/youtube-transcript-enrichment/DECISION_LOG.md",
      "docs/feature-council/youtube-transcript-enrichment/spikes/SPIKE_REGISTER.md",
      "docs/feature-council/youtube-transcript-enrichment/technical/RISK_REGISTER.md"
    ],
    "mutable_document_policy": "result_status_evidence_links_and_append_only_history_only_no_redefinition_of_frozen_claims",
    "conflict_rule": "verified_lock_and_frozen_machine_authorities_control_over_mutable_governance_status"
  }
}
